number,value,datetime_start,datetime_complete,duration,params_big_down_prob_threshold,params_big_up_prob_threshold,params_decision_target_label,params_defensive_cut_exposure,params_drawdown_threshold,params_family,params_high_volatility_multiplier,params_max_position_change,params_mild_cut_exposure,params_min_strong_up_position,params_no_trade_band,params_opportunity_cost_buffer,params_severe_defensive_exposure,params_signal_candidate_id,params_tail_score_threshold,user_attrs_experiment_id,user_attrs_failure_reason,user_attrs_status,user_attrs_test_excess_return_vs_buy_hold,state
0,1.5104338880190096,2026-06-14 19:08:00.085958,2026-06-14 19:14:57.103690,0 days 00:06:57.017732,0.6519478051453376,0.5985175961393013,reduce_position_worth_label,0.9854645041272,0.1369331322352,ml_bull_full_participation_enhancement,1.1162628982463199,0.22615344229334267,0.9953317311197584,0.9965875843968948,0.033641929894983325,0.0024551152266096303,0.9751886212975359,6,0.02571172192068058,auto_20260614_190800_exp_001,,ok,0.0,COMPLETE
1,1.5104338880190096,2026-06-14 19:14:57.104180,2026-06-14 19:23:52.810247,0 days 00:08:55.706067,0.6770805322709743,0.6028737509151929,avoid_loss_label,0.9864092422497476,0.12633468615779947,ml_bull_full_participation_enhancement,1.3467217341501294,0.35386535711370853,0.9948842647484243,0.98738458817841,0.025964051494381666,0.0010099398108224843,0.980054924518851,8,0.01404672548436904,auto_20260614_190800_exp_002,,ok,-0.0005081751649975708,COMPLETE
2,1.5589046393200339,2026-06-14 19:23:52.810631,2026-06-14 19:23:53.195121,0 days 00:00:00.384490,0.57471437785301,0.5407891426993304,big_down_label,0.9552571207349411,0.10777755692715243,ml_conservative_full_participation_enhancement,1.1702842430678386,0.222437863228442,0.9728588995269082,0.9568639449647486,0.02621815031169937,0.0009077718737603102,0.9453783236963046,9,0.03182052056318902,auto_20260614_190800_exp_003,,ok,-0.023979394916966434,COMPLETE
3,1.7048742668068624,2026-06-14 19:23:53.195346,2026-06-14 19:23:53.599448,0 days 00:00:00.404102,0.7324830334232285,0.5718790621743366,avoid_loss_label,0.9946244729494211,0.09709042966264805,ml_bull_full_participation_enhancement,1.1752195774541925,0.27566975580721537,0.9987460387444886,0.9854426433682544,0.05977988047139084,0.0020972158011638145,0.9662945573956341,5,0.0181814801189647,auto_20260614_190800_exp_004,,ok,0.003960528923004691,COMPLETE
4,1.3580857222551967,2026-06-14 19:23:53.599671,2026-06-14 19:23:53.951640,0 days 00:00:00.351969,0.6667759185614175,0.5526495775197938,big_down_label,0.9516020603890161,0.07567367606202946,ml_conservative_full_participation_enhancement,1.155034597231057,0.2144854069287889,0.9822734434525616,0.9777408085483569,0.021188442486569696,0.0020282750947333734,0.9468364994368367,1,0.008718321450249573,auto_20260614_190800_exp_005,,ok,-0.024077049413807394,COMPLETE
5,1.5062981322727944,2026-06-14 19:23:53.951844,2026-06-14 19:23:54.307973,0 days 00:00:00.356129,0.730703231630831,0.5748733789366586,big_down_label,0.9921217922134754,0.11897797394283288,ml_bull_full_participation_enhancement,1.2866228512795062,0.29207715083386787,0.992018423785145,0.9951906809259301,0.04603197585274142,0.002183703206140618,0.96593122718742,2,0.03259806297513003,auto_20260614_190800_exp_006,,ok,-0.0008676350017675638,COMPLETE
6,0.22967160522087227,2026-06-14 19:23:54.308179,2026-06-14 19:23:54.626244,0 days 00:00:00.318065,0.6945429965633879,0.6363320300948037,avoid_loss_label,0.910807818288154,0.0878400631229175,ml_direct_signal_timing,1.1172884042709403,0.2925152925223412,0.9603057112224355,0.9780846432248234,0.022676880206251106,0.001983250654347454,0.9051136671516857,14,0.042650472773368,auto_20260614_190800_exp_007,,ok,-0.19587473833764335,COMPLETE
7,1.5400949626130693,2026-06-14 19:23:54.626422,2026-06-14 19:23:55.019169,0 days 00:00:00.392747,0.5753913410695113,0.5878280140996174,big_up_label,0.9485962375638485,0.11113002803298291,ml_conservative_full_participation_enhancement,1.0882166015248271,0.2805608150137011,0.9785661158676894,0.9608057192423378,0.016372511247257224,0.0009778847177126387,0.9295416630284505,9,0.02327990090662301,auto_20260614_190800_exp_008,,ok,-0.02476846068949179,COMPLETE
8,0.7017470613777792,2026-06-14 19:23:55.019482,2026-06-14 19:23:55.348234,0 days 00:00:00.328752,0.6490296065076597,0.6086055514970069,reduce_position_worth_label,0.9390317533356615,0.07238654947505788,ml_big_up_index_enhancement,1.1723120137341139,0.15359837215743896,0.9834202848232118,0.9606791803595378,0.03446882984937409,0.0020883383877894277,0.87543540525114,4,0.013996694847297143,auto_20260614_190800_exp_009,,ok,-0.10269320759212697,COMPLETE
9,1.5104338880190096,2026-06-14 19:23:55.348460,2026-06-14 19:23:55.697723,0 days 00:00:00.349263,0.6863211266813818,0.6246207217282462,big_down_label,0.9637475867147455,0.1280595281911957,ml_ultra_conservative_full_participation_enhancement,1.1965256594501936,0.16734032521879136,0.9878657643688471,0.9816872724684622,0.07648788852659151,0.0010741075887050152,0.9418246715726374,13,0.023290195572391315,auto_20260614_190800_exp_010,,ok,0.00419354535187022,COMPLETE
10,0.4911327252963349,2026-06-14 19:23:55.697942,2026-06-14 19:23:56.080719,0 days 00:00:00.382777,0.6095813614546693,0.5681535980547284,avoid_loss_label,0.8825582363359217,0.061049605026427575,ml_big_up_index_enhancement,1.2292158359452756,0.39653835993683295,0.9505458179880459,0.9669293337233182,0.049694506618413486,0.0015384056619858993,0.8296968779748279,5,0.0019362599980591588,auto_20260614_190800_exp_011,,ok,-0.15998103486944837,COMPLETE
11,1.6568527526352657,2026-06-14 19:23:56.081035,2026-06-14 19:23:56.465871,0 days 00:00:00.384836,0.5724133474356784,0.530679377553584,big_up_label,0.9631499242977081,0.10025822841869272,ml_conservative_full_participation_enhancement,1.2161282892254006,0.2329549892304762,0.9736423436312066,0.951455709598729,0.05908205935327196,0.0013969393708641717,0.9400924002542738,9,0.04680172142755488,auto_20260614_190800_exp_012,,ok,-0.0009185495805552613,COMPLETE
12,0.33002559913644147,2026-06-14 19:23:56.466093,2026-06-14 19:23:56.894621,0 days 00:00:00.428528,0.6101433954523066,0.5375830789994238,big_up_label,0.9289844612542658,0.09439985159433112,ml_direct_signal_timing,1.224826738252827,0.26308157821940215,0.9684417025186564,0.9521702084868046,0.04984067957444854,0.0015640566194540914,0.9008066034447164,15,0.049882352039829714,auto_20260614_190800_exp_013,,ok,-0.20456803721768302,COMPLETE
13,1.5104338880190096,2026-06-14 19:23:56.894843,2026-06-14 19:23:57.330106,0 days 00:00:00.435263,0.7318119785335642,0.561461923962798,big_up_label,0.9703857699357901,0.10272936319179017,ml_ultra_conservative_full_participation_enhancement,1.2598671165677195,0.3377493090031315,0.9889898180556518,0.9679648557459328,0.0652579142749477,0.0013747068079163263,0.9525733190254173,10,0.05896116940666827,auto_20260614_190800_exp_014,,ok,0.003047469816229942,COMPLETE
14,1.379795954911292,2026-06-14 19:23:57.330461,2026-06-14 19:23:57.728850,0 days 00:00:00.398389,0.6170054708104209,0.531956955590565,big_up_label,0.9619738712479254,0.09566580033193482,ml_conservative_full_participation_enhancement,1.2062116828512304,0.2544537454790912,0.9755957536787061,0.950787783466003,0.056499136432343514,0.0017349094294177294,0.9321423715295277,5,0.03848617729700952,auto_20260614_190800_exp_015,,ok,-0.01806453737390523,COMPLETE
15,1.5104338880190096,2026-06-14 19:23:57.729259,2026-06-14 19:23:58.091473,0 days 00:00:00.362214,0.7696589384814919,0.520676569076824,avoid_loss_label,0.9939829826681892,0.09928426933510111,ml_bull_full_participation_enhancement,1.2656670841187885,0.18659560392008975,0.9986677131398891,0.9925915647131478,0.09930217569148797,0.0027802212666404513,0.9819875198972017,12,0.01653586271960878,auto_20260614_190800_exp_016,,ok,0.0015152751486602334,COMPLETE
16,1.4531450236802168,2026-06-14 19:23:58.091689,2026-06-14 19:23:58.401778,0 days 00:00:00.310089,0.6306253131354244,0.5826111045721564,avoid_loss_label,0.9636921784551294,0.08830451504999001,ml_conservative_full_participation_enhancement,1.1418930803743645,0.3266627873887803,0.9694150982501214,0.9692511251956265,0.05933264775983379,0.0012478779984949667,0.927438491739357,0,0.006502579115395233,auto_20260614_190800_exp_017,,ok,-0.001157976148085993,COMPLETE
17,1.5104338880190096,2026-06-14 19:23:58.402015,2026-06-14 19:23:58.754828,0 days 00:00:00.352813,0.7751367782120178,0.5532416562899801,big_up_label,0.9916926612833734,0.10846419482534662,ml_bull_full_participation_enhancement,1.308180593209766,0.20357084699436762,0.9989051512997891,0.9912604497634646,0.07604979557357996,0.00234475767893965,0.9738402022553287,7,0.033037345669550064,auto_20260614_190800_exp_018,,ok,0.0030285122497191175,COMPLETE
18,0.8456661680456475,2026-06-14 19:23:58.755156,2026-06-14 19:23:59.091311,0 days 00:00:00.336155,0.5521590880439916,0.5510063547758778,reduce_position_worth_label,0.926175751689128,0.08739512759421719,ml_big_up_index_enhancement,1.1978466618714458,0.24234474163743278,0.9601314049091645,0.9717544779447215,0.041149792000476186,0.0017983580107766507,0.9028759232759587,3,0.042504122865624605,auto_20260614_190800_exp_019,,ok,-0.07767091749491506,COMPLETE
19,1.5104338880190096,2026-06-14 19:23:59.091557,2026-06-14 19:23:59.405132,0 days 00:00:00.313575,0.7042891785739117,0.5912493669071368,avoid_loss_label,0.9718055581567538,0.10206050139509461,ml_ultra_conservative_full_participation_enhancement,1.2357887370448284,0.3211829973970093,0.985976600679515,0.9631364844274473,0.06749271494301849,0.0012067693530795716,0.9537618201934531,11,0.05989026834409356,auto_20260614_190800_exp_020,,ok,-0.009137918909086995,COMPLETE
20,0.4180599236709065,2026-06-14 19:23:59.405364,2026-06-14 19:23:59.751716,0 days 00:00:00.346352,0.5895855690743677,0.6186743451848313,big_up_label,0.9390936903979401,0.08278592589702587,ml_direct_signal_timing,1.1788610283647385,0.2727093829099153,0.9616313811678975,0.9545816192113291,0.042879396334520786,0.0008157521851077788,0.9096684837400194,9,0.027515046408332956,auto_20260614_190800_exp_021,,ok,-0.15988579053087593,COMPLETE
21,1.1045354521510788,2026-06-14 19:23:59.751961,2026-06-14 19:24:00.064443,0 days 00:00:00.312482,0.5864053500534737,0.5400169953957485,big_down_label,0.956862948293522,0.10789622334230686,ml_conservative_full_participation_enhancement,1.1705167879713942,0.23627721260743453,0.9749425200866084,0.9561418957237253,0.03481044490990144,0.0008144878145567352,0.9365704062064835,9,0.01906767917443667,auto_20260614_190800_exp_022,,ok,-0.026117872705869516,COMPLETE
22,1.6568527526352657,2026-06-14 19:24:00.064640,2026-06-14 19:24:00.398267,0 days 00:00:00.333627,0.5705117162528104,0.5453981630456799,big_down_label,0.9566795751386972,0.10467751249806803,ml_conservative_full_participation_enhancement,1.1309259448068367,0.19144903588677512,0.9749938418403061,0.9562197604452007,0.053471658992752163,0.001453657046626017,0.9396816531442838,9,0.03234155942000761,auto_20260614_190800_exp_023,,ok,-0.0009185495805552613,COMPLETE
23,1.3118155126429285,2026-06-14 19:24:00.398538,2026-06-14 19:24:00.722116,0 days 00:00:00.323578,0.5927490655221711,0.5694906262774582,big_down_label,0.9595631365707512,0.0949287402732374,ml_conservative_full_participation_enhancement,1.1254459838134545,0.18889266222763168,0.9787497447201513,0.9530629874089378,0.052980285024800955,0.0015111035627098485,0.9233134412891271,5,0.03582749748326593,auto_20260614_190800_exp_024,,ok,-0.024533641057094435,COMPLETE
24,1.097131981061085,2026-06-14 19:24:00.722325,2026-06-14 19:24:01.128326,0 days 00:00:00.406001,0.6300471641822282,0.5303030068025162,avoid_loss_label,0.9524853345289865,0.1005899349453817,ml_conservative_full_participation_enhancement,1.1006568398629302,0.1932264686361602,0.9796765596118725,0.9579164518989032,0.05326358697066147,0.0013649963291371546,0.9196339455640111,9,0.0448141699232484,auto_20260614_190800_exp_025,,ok,-0.02647611518286963,COMPLETE
25,1.5104338880190096,2026-06-14 19:24:01.128699,2026-06-14 19:24:01.512514,0 days 00:00:00.383815,0.753926655747502,0.5215070502872395,big_up_label,0.9903259897931247,0.1171894069154968,ml_bull_full_participation_enhancement,1.1437346583011256,0.16963267941551213,0.9974505892001501,0.9894120742930198,0.07335231453059614,0.001768044212303069,0.9710628936812166,14,0.04809518440408322,auto_20260614_190800_exp_026,,ok,0.0,COMPLETE
26,1.423765525084705,2026-06-14 19:24:01.512834,2026-06-14 19:24:01.846500,0 days 00:00:00.333666,0.5707232884267085,0.547092093868114,big_down_label,0.9595133942552322,0.0976022470112022,ml_conservative_full_participation_enhancement,1.2148780053590005,0.24561318733001944,0.9712710297250099,0.9639490794535227,0.05559724477421273,0.0016545847425409109,0.9370317703252735,4,0.037868401314526214,auto_20260614_190800_exp_027,,ok,-0.04238502564766744,COMPLETE
27,1.402720696708123,2026-06-14 19:24:01.846680,2026-06-14 19:24:02.271799,0 days 00:00:00.425119,0.601701018465261,0.561513682298622,reduce_position_worth_label,0.9666775098332232,0.09145704028576619,ml_conservative_full_participation_enhancement,1.1897247333179837,0.2964538664501212,0.9761403318274693,0.954170481925146,0.048127066746529425,0.0013977358633980432,0.9370549300215508,3,0.03000301847875507,auto_20260614_190800_exp_028,,ok,-0.012515920052099894,COMPLETE
28,1.5065414919094458,2026-06-14 19:24:02.272206,2026-06-14 19:24:02.654769,0 days 00:00:00.382563,0.6388983360642544,0.5285089500742803,big_up_label,0.989139079093037,0.10447860862674413,ml_bull_full_participation_enhancement,1.1527654401453977,0.2047000341269594,0.9952698255425864,0.986684165893759,0.08681444070402752,0.001897227075895499,0.9684110611672901,1,0.021067051708520572,auto_20260614_190800_exp_029,,ok,0.0037275173983202237,COMPLETE
29,1.5104338880190096,2026-06-14 19:24:02.655152,2026-06-14 19:24:03.030131,0 days 00:00:00.374979,0.7160234060251933,0.5611350551926697,reduce_position_worth_label,0.9948341141652228,0.11516139738643555,ml_bull_full_participation_enhancement,1.1262032964795363,0.22625475120388377,0.996254476181786,0.9952308884223277,0.06286924317331512,0.002680537090593983,0.9775856734298697,13,0.02858137806564718,auto_20260614_190800_exp_030,,ok,0.0,COMPLETE
30,0.810291890562445,2026-06-14 19:24:03.030445,2026-06-14 19:24:03.377752,0 days 00:00:00.347307,0.5621862735855537,0.5444680309236295,big_down_label,0.9435314438786696,0.09087808932580167,ml_big_up_index_enhancement,1.2421265305445413,0.3079859624684211,0.9653871159437569,0.9739235149799246,0.043386959367381246,0.001174010037012028,0.9114393604674188,6,0.024930165018747938,auto_20260614_190800_exp_031,,ok,-0.07765193523629321,COMPLETE
31,1.1045547799546214,2026-06-14 19:24:03.377957,2026-06-14 19:24:03.751145,0 days 00:00:00.373188,0.5822579044891815,0.5407993389320115,big_down_label,0.9550819671204729,0.10494860787524099,ml_conservative_full_participation_enhancement,1.1823380030549573,0.2264839494471259,0.9733864588754974,0.9571705665472839,0.029164246813880707,0.0009628852597896375,0.9423318390640126,9,0.03133400047090611,auto_20260614_190800_exp_032,,ok,-0.023019564618810495,COMPLETE
32,1.4205983354319747,2026-06-14 19:24:03.751322,2026-06-14 19:24:04.101557,0 days 00:00:00.350235,0.6016858643504437,0.5561114513653576,big_down_label,0.955413481299449,0.10745436656187451,ml_conservative_full_participation_enhancement,1.1627718609913646,0.21238007922410346,0.9727244395208318,0.9501730606711997,0.038637572065009715,0.0012796829533885286,0.9422477066849386,8,0.011889738945817957,auto_20260614_190800_exp_033,,ok,-0.027269659055272566,COMPLETE
33,1.6705853246812923,2026-06-14 19:24:04.101765,2026-06-14 19:24:04.448545,0 days 00:00:00.346780,0.6585181569424244,0.5455146143231374,big_down_label,0.9520313346436978,0.11115648437606374,ml_conservative_full_participation_enhancement,1.1430970969066918,0.22382293874566644,0.9772738279951609,0.9596111413839529,0.029899794336122828,0.0018714819956266173,0.9475355105334741,9,0.035464762331817445,auto_20260614_190800_exp_034,,ok,-0.024291546813978382,COMPLETE
34,1.1077551379053279,2026-06-14 19:24:04.448737,2026-06-14 19:24:04.758208,0 days 00:00:00.309471,0.6695487348900989,0.5479092762815577,big_down_label,0.9505189971046218,0.1127085601994082,ml_conservative_full_participation_enhancement,1.1421632883715822,0.2611410580642223,0.9768768098909426,0.9587230685007205,0.031200352685818545,0.0018888107927555768,0.9341016969894641,9,0.03574683259604511,auto_20260614_190800_exp_035,,ok,-0.023569566354562532,COMPLETE
35,1.3750176225666384,2026-06-14 19:24:04.758443,2026-06-14 19:24:05.071481,0 days 00:00:00.313038,0.6611363915522246,0.5809815399646114,avoid_loss_label,0.9486587856266762,0.10476159742902975,ml_conservative_full_participation_enhancement,1.1070714253296612,0.17773705032100476,0.981727638596657,0.9553238647699921,0.03731704511289317,0.0014564830348341657,0.9468263654151725,2,0.040548430731119044,auto_20260614_190800_exp_036,,ok,-0.026656861476753058,COMPLETE
36,1.5024977900173142,2026-06-14 19:24:05.071689,2026-06-14 19:24:05.374852,0 days 00:00:00.303163,0.7416063853995107,0.535101185725594,big_down_label,0.988031627839372,0.12348057925746386,ml_bull_full_participation_enhancement,1.348931691805513,0.22972216928772873,0.9937056361363837,0.9867361808112688,0.07138458007961697,0.0022553269647923716,0.9645189747481151,9,0.04446381316962066,auto_20260614_190800_exp_037,,ok,0.0035553631759031035,COMPLETE
37,0.390919413600317,2026-06-14 19:24:05.375176,2026-06-14 19:24:05.674578,0 days 00:00:00.299402,0.5502333618526004,0.5692852552529134,big_down_label,0.9438122052727427,0.09912354142007242,ml_direct_signal_timing,1.1316360758575639,0.2749006485573615,0.9531148489522131,0.9522516178582967,0.013730237779445015,0.0021201032003259892,0.9141720047013996,15,0.04880235084708641,auto_20260614_190800_exp_038,,ok,-0.17836341250230592,COMPLETE
38,1.4959463693627588,2026-06-14 19:24:05.674806,2026-06-14 19:24:06.016810,0 days 00:00:00.342004,0.6790236845976086,0.544279236536306,avoid_loss_label,0.9530610001316336,0.10971889473996604,ml_conservative_full_participation_enhancement,1.0893922404150391,0.21017534009058314,0.9738576826080612,0.9594743224571387,0.052662598374823844,0.001915990823088341,0.9405963489854486,12,0.03351932013452663,auto_20260614_190800_exp_039,,ok,-0.01418559996505886,COMPLETE
39,1.5104338880190096,2026-06-14 19:24:06.017117,2026-06-14 19:24:06.379237,0 days 00:00:00.362120,0.7108799455974136,0.5567531635660863,big_down_label,0.9777564795708894,0.11265548735178703,ml_ultra_conservative_full_participation_enhancement,1.1553167955914354,0.24773907993252167,0.9910157764528602,0.976729976263995,0.060503049013510904,0.00199301352786255,0.9519544803034048,11,0.05097745056260447,auto_20260614_190800_exp_040,,ok,-0.009535305265925498,COMPLETE
40,1.476156140839002,2026-06-14 19:24:06.379451,2026-06-14 19:24:06.726653,0 days 00:00:00.347202,0.6554515730665842,0.6022019460979869,avoid_loss_label,0.9582818500106326,0.09752177184076394,ml_conservative_full_participation_enhancement,1.113114515750783,0.1548053410143505,0.9774378869200724,0.9606797546044327,0.024291738163654014,0.0016511941035730086,0.9447694870582111,10,0.009509900091965506,auto_20260614_190800_exp_041,,ok,-0.024446178216358305,COMPLETE
41,1.5508054850547124,2026-06-14 19:24:06.726882,2026-06-14 19:24:07.044194,0 days 00:00:00.317312,0.5798895391422587,0.5418719712333093,big_down_label,0.9547403291970741,0.10525974124498938,ml_conservative_full_participation_enhancement,1.1651713721837247,0.21911748341703266,0.9721530492309395,0.9636148970565177,0.019893694629759522,0.0010919786117758311,0.9385705340036455,9,0.02705504311672241,auto_20260614_190800_exp_042,,ok,-0.02329183725540629,COMPLETE
42,1.6681405623340737,2026-06-14 19:24:07.044541,2026-06-14 19:24:07.454187,0 days 00:00:00.409646,0.5966089315786093,0.536053010324149,big_down_label,0.9504305800569609,0.10203632053350907,ml_conservative_full_participation_enhancement,1.2100550522301918,0.37048530482281206,0.9711169631337296,0.9565890025575868,0.03057134116448735,0.0009427042492526349,0.9453121785966941,9,0.0349539509839439,auto_20260614_190800_exp_043,,ok,-0.0247930320082812,COMPLETE
43,1.5803332959664982,2026-06-14 19:24:07.454476,2026-06-14 19:24:07.824589,0 days 00:00:00.370113,0.5943073802749108,0.5366363352173513,big_down_label,0.9496824647294034,0.1021434918269594,ml_conservative_full_participation_enhancement,1.212748069174358,0.38566593738439797,0.9706637407705878,0.9560968195063141,0.028231453347446082,0.0010948654497558578,0.9447122532523421,9,0.03953653259204442,auto_20260614_190800_exp_044,,ok,-0.024814624418190157,COMPLETE
44,1.3132922229400363,2026-06-14 19:24:07.824959,2026-06-14 19:24:08.175350,0 days 00:00:00.350391,0.5976081986774054,0.5499478302083742,big_down_label,0.9462802779627756,0.0930266595010373,ml_conservative_full_participation_enhancement,1.1890926042539902,0.37678271420644005,0.9746523727974907,0.9534581726220208,0.031314104031116896,0.0018432132991098701,0.9322910167920835,5,0.03633903822696715,auto_20260614_190800_exp_045,,ok,-0.023912540402361238,COMPLETE
