number,value,datetime_start,datetime_complete,duration,params_big_down_prob_threshold,params_big_up_prob_threshold,params_decision_target_label,params_defensive_cut_exposure,params_drawdown_threshold,params_family,params_high_volatility_multiplier,params_max_position_change,params_mild_cut_exposure,params_min_strong_up_position,params_no_trade_band,params_opportunity_cost_buffer,params_severe_defensive_exposure,params_signal_candidate_id,params_tail_score_threshold,user_attrs_experiment_id,user_attrs_failure_reason,user_attrs_status,user_attrs_test_excess_return_vs_buy_hold,state
45,1.5104338880190096,2026-06-14 19:24:08.175686,2026-06-14 19:24:08.602212,0 days 00:00:00.426526,0.6288258443570518,0.5282046665428379,big_up_label,0.9864040210713023,0.13244105980495288,ml_bull_full_participation_enhancement,1.2446123518134253,0.1972801999580473,0.9940376521547796,0.9881913188265111,0.08231419321199479,0.002362168936947592,0.9620561236271388,7,0.00010376313470686696,auto_20260614_190800_exp_046,,ok,0.004426566684889721,COMPLETE
46,0.2358546248689506,2026-06-14 19:24:08.602558,2026-06-14 19:24:08.927602,0 days 00:00:00.325044,0.5632543818414631,0.5742831377050189,big_down_label,0.9346904387728672,0.09719275933566339,ml_direct_signal_timing,1.221530521382572,0.3578581766211173,0.9673192753924882,0.9512781127574874,0.04617351384089166,0.0021810305698384677,0.914716307661176,0,0.02164721071277042,auto_20260614_190800_exp_047,,ok,-0.15560024607995104,COMPLETE
47,1.4174950935351271,2026-06-14 19:24:08.927779,2026-06-14 19:24:09.284216,0 days 00:00:00.356437,0.6079362091836799,0.5939056476959681,reduce_position_worth_label,0.9538790484427826,0.11130552327690607,ml_conservative_full_participation_enhancement,1.2006717722631126,0.289466951079463,0.98468675447572,0.9622810445095723,0.055347814188292085,0.0016374825695304783,0.9398571801541893,8,0.01635043587589754,auto_20260614_190800_exp_048,,ok,0.0002879305346481509,COMPLETE
48,0.7867726042034618,2026-06-14 19:24:09.284403,2026-06-14 19:24:09.705661,0 days 00:00:00.421258,0.5676984437890599,0.5366107336654274,big_up_label,0.92151828264043,0.10261261386438346,ml_big_up_index_enhancement,1.1327665469250734,0.34349370199714824,0.9653403087223981,0.966025408837478,0.01104233438779452,0.0020710848122016162,0.9156655523299253,6,0.04237354870776611,auto_20260614_190800_exp_049,,ok,-0.07410128987511078,COMPLETE
49,1.5076364867148453,2026-06-14 19:24:09.705859,2026-06-14 19:24:10.026048,0 days 00:00:00.320189,0.6175224462148186,0.5548074138841985,avoid_loss_label,0.976618788755538,0.12092509408876025,ml_ultra_conservative_full_participation_enhancement,1.2555433263255555,0.1749739891102305,0.9773589060289709,0.9789038576177672,0.05895629574432762,0.00090385072381967,0.9489397827074233,9,0.05298151687414847,auto_20260614_190800_exp_050,,ok,0.005180586836216694,COMPLETE
